We were trying  Carey on Allan Border s disgraceful performance remark,sports
We will never forget cowardly attack on Parliament in 2001  PM Modi,politics
Web has given a new life not only to actors but to stories  Shweta,entertainment
What s he looking at  Warne on umpire Oxenford s blunder in Australia-India Test,sports
Whatever we are today is because of theatres and our films  Rajkummar,entertainment
Which sportspersons earned the most in 2020 as per Forbes?,sports
Who are the world s highest-paid YouTubers of 2020 and what are their earnings?,technology
Who are the world s top 10 highest-paid celebrities of 2020 as per Forbes? ,entertainment
WHO chief should be probed over genocide in Ethiopia  Economist,world
Who will face who in the Champions League Round of 16?,sports
Who won what at The Best FIFA Football Awards 2020?,sports
Why new Parliament building when half of India hungry?  Haasan to PM Modi,politics
Why should protests take place in America & London for farmers?  MoS,politics
Will decide after the India series  Paine on his future as player and captain,sports
Will definitely miss Ishant yet to decide team combination  Rahane,sports
Will look into inaction against Bajrang Dal if referred  FB Oversight Board,technology
Will take vaccine publicly when my turn comes  Bill Gates,technology
Wish you a speedy recovery  PM Modi to Macron after he tests COVID-19 positive,world
Woman drives car into BLM protesters in Manhattan several injured,world
Women post pics of legs in stockings to support jailed ex-Miss Belarus,world
Won t shy away from disinformation hate speech  Facebook Oversight Board,technology
Won t use our people to test a vaccine from any country  Cambodia,world
Workers of Toyota unit near B luru to continue strike over workload,automobile
World has entered era of consequences of global warming  French envoy,world
World s ugliest orchid featured in Kew s list of 2020 s top 10 discoveries,science
WWII grenade that UK mom & daughter thought to be fossil explodes in kitchen sink,world
Yemen at highest risk of humanitarian catastrophe in 2021  IRC,world
Yogasana formally recognised as a competitive sport in India,sports
You are welcome to have your child in Australia  Brett Lee to Virat Kohli,sports
YouTuber CarryMinati to make B wood debut with Big B Ajay s MayDay,entertainment
Yuvraj named in Punjab s 30-man probable squad for Syed Mushtaq Ali Trophy,sports
Yuvraj s father dropped from film over Hindu women were sold for 2 cents remark,entertainment
Zombie Angelina Jolie seen for 1st time since she was released from prison,world
Zoom Founder Eric Yuan named TIME s 2020 Businessperson of the Year,technology
