 BJP leaders statements on farmers protest condemnable  Gehlot,politics
 BJP leaders statements on farmers protest condemnable  Gehlot,politics
1 000 vehicles stuck in 16-km-long traffic jam after snow storm in Japan,world
100 BJP workers booked for organising welcome rally in Gr Noida,politics
18 fishermen held in Libya freed after more than 100 days  Italy,world
1bn COVID-19 vaccine doses secured for low middle income nations  WHO,world
1st known case of COVID-19 in non-captive wild mink found in US,world
1st known case of COVID-19 in non-captive wild mink found in US,science
1st tied Test match was caused by direct hit off penultimate ball,sports
2 develop allergic reactions after receiving Pfizer s vaccine in US  Report,world
28% Indians hide real identities on social media  Report,technology
30 000 tremors hit Antarctica in 3 months  Scientists,science
344 boys kidnapped from Nigerian boarding school released  Official,world
4 killed in recent clashes in Nagorno-Karabakh region  Azerbaijan ,world
4 volunteers who got Pfizer vaccine developed temporary facial paralysis  US FDA,science
400 students missing after bandits armed with rifles attack school in Nigeria,world
5 members quit Mission Impossible 7 as Cruise shouts & swears at them again  Report,entertainment
51st IFFI to be organised in Goa from January 16-24,entertainment
52-yr-old Josh Brolin shares nude pic fans say Thanos has a retirement plan ,entertainment
58-year-old man trapped for 10 hours after his car gets buried under 4 feet of snow,world
6 AAP MLAs including Raghav Atishi detained outside Amit Shah & L-G s houses,politics
6 arrested for trespassing and forceful entry into Sisodia s house,politics
7 000 people booked for violence at Karnataka s iPhone manufacturing plant,technology
7 of top 10 killers pre-COVID-19 were non-communicable diseases  WHO,science
8 nations accuse N Korea of using COVID-19 to crack down on rights,world
820-foot-tall world s largest crane completes its biggest ever lift pics surface,world
99.9% Congress members want Rahul Gandhi as party chief  Surjewala,politics
A designer told my team they don t give clothes to TV actors  Shivangi Joshi,entertainment
Aakanksha Singh joins cast of MayDay to play Ajay s wife,entertainment
Aanand L Rai to direct a biopic on Viswanathan Anand  Reports,entertainment
AAP to contest UP elections in 2022  Arvind Kejriwal,politics
AAP to stage protest outside Delhi L-G Amit Shah s homes tomorrow,politics
Abhay Deol Karan Deol in talks to star in Ajay s Velley  Reports,entertainment
Abhishek to team up with Dinesh Vijan and Tushar Jalota for a film,entertainment
Actress says she was sexually harassed at mall shares ordeal on Instagram,entertainment
Addressing cybersecurity important for financial inclusion  RBI Guv,technology
Advisory panel to US FDA endorses emergency use of Moderna vaccine,world
Afghan Taliban head bought life insurance in Pak before dying in US strike  Report,world
After attack on Nadda s convoy Kailash Vijayvargiya gets bulletproof car,politics
After Elon Musk Oracle Founder Larry Ellison leaves California,technology
After watching my music videos people feel I can become actor  Armaan,entertainment
Ajay Devgn s Maidaan release date pushed to October 15,entertainment
Ajay to remake Telugu comedy film Brochevarevarura in Hindi  Reports,entertainment
Alcohol found in actress Arya Banerjee s stomach death not a case of homicide,entertainment
Alexey Navalny working with US intelligence  Russian Prez Putin,world
Alibaba facial recognition tech specifically identifies Uighurs  IPVM,technology
Aliens exist; they re in contact with US & Israel  Israel s ex-space security chief,science
Amazon accused of failing to comply with COVID-19 probe in US,technology
Amazon s Zoox unveils autonomous EV that can travel both ways,technology
Amazon s Zoox unveils autonomous EV that can travel both ways,automobile
America stood with India as it faced Chinese aggression  US official,world
Andre Fletcher smashes six with no-look shot in BBL video goes viral,sports
Apple building its own cellular modem for future devices  Report,technology
Apple CFO Apple s ex-design chief candidates for Ferrari CEO  Report,technology
Apple CFO Apple s ex-design chief candidates for Ferrari CEO  Report,automobile
Apple Google ban tech that lets apps track users location  Report,technology
Apple launches store privacy labels to show users apps data collection,technology
Apple may bring Touch ID back under upcoming iPhones display  Report,technology
Apple moves self-driving car unit under exec who oversees Siri  Report,automobile
Apple shuts Music Memos app asks users to export files to Voice Memos,technology
Apple sued by app store Cydia over alleged App Store monopoly in US,technology
Arjun Rampal seeks time till Dec 21 to appear before NCB in drugs case,entertainment
Arjun Rampal summoned again by NCB on Dec 16 in drug-related case,entertainment
Armed forces being used to rig J&K DDC polls  Ex-CM Mehbooba Mufti,politics
Armenia Azerbaijan swap prisoners captured during conflict,world
As far as captaincy is concerned no pressure on Rahane  Gavaskar,sports
Assam cabinet clears proposal to shut govt-run madrassas Sanskrit tols,politics
Assam s BTC poll results show people s faith in PM s leadership  Nadda,politics
Aston Villa captain given 9-month driving ban for crashing into parked vehicles,sports
AstraZeneca to test combining Oxford vaccine with Sputnik V vaccine,science
At least 10 rockets hit Kabul 2 land near airport,world
Aus have Warner Smith Labuschagne this time  Tendulkar on Test series,sports
Aus much better Test team than it was 2 yrs ago  Vaughan on India Tests,sports
Aus players who play in IPL won t fight Paine can confront Indian players  Kaif,sports
Aus should make Smith vice-captain immediately  Gilchrist ,sports
Aus soldier quits after pic of him drinking from fake leg of Taliban fighter emerges,world
Aus vaccine trial scrapped as participants returned false +ve HIV test results,science
Australia fail to secure a 1st innings lead in D-N Test cricket history for 1st time,sports
Australia still the number one Test side ahead of NZ on decimal points clarifies ICC,sports
Australia sues Facebook for promoting VPN collecting user data,technology
Australia sues Facebook for promoting VPN collecting user data,world
Australia underestimated him  Ponting on Ashwin s 4/55,sports
Australian Open 2021 delayed will now begin from Feb 8 in Melbourne  ATP,sports
Austria s top court overturns headscarf ban in primary schools,world
Bacteria can travel between continents via dust impact climate  Study,science
Baidu becomes 1st to get fully driverless road tests permit in Beijing,automobile
Ball gets hidden inside batsman s sweater as he tries to steal single video viral,sports
Ball hit my stomach it made me angry  Pant on scoring 22 in 5 balls to hit ton,sports
Bangladeshis settling in Bengal natives being driven out  Nadda,politics
Battery-operated bikes to be included in Delhi s EV policy  Report,automobile
Before and after pics show collapse of world s 2nd largest radio telescope,science
Being a public figure does not mean public property  Kirti,entertainment
Best part of my life will always be you  Genelia on Riteish s b day,entertainment
Bharatiya Tribal Party withdraws support to Gehlot-led Raj govt  Party leader,politics
Bhiku Mhatre has given me a career  Manoj on his character in Satya ,entertainment
Biden names Indian-American Vedant Patel as Assistant WH Secretary,world
Bihar Cabinet approves free coronavirus vaccine for all in state,politics
Bilawal rules out talks with Pak govt says time for PM to resign,world
Biopic on Major Dhyan Chand announced film to release in 2022,entertainment
Bitcoin price surpasses $20 000 for the first time,technology
BJP ahead of Congress with 1 916 seats in Rajasthan panchayat polls,politics
BJP chief Nadda to begin his two-day visit to West Bengal tomorrow,politics
BJP launched campaign to divide farmers defame movement  Akhilesh,politics
BJP leaders sitting on strike broke CCTV cameras at Delhi CM s house  CMO,politics
BJP may try to kill CM Mamata if it can t win against her  Bengal Minister,politics
BJP President JP Nadda tests positive for coronavirus goes into home-isolation,politics
BJP wins 32 out of 49 seats in Goa Zilla Panchayat polls Cong wins 4,politics
BJP workers attack one another blame TMC  Mamata on attack on Nadda,politics
BJP-ruled MCDs hiked 11 taxes in past 3 days  AAP s Durgesh Pathak,politics
Blast on oil tanker caused by explosive-laden boat  Saudi Arabia ,world
Blue Origin receives NASA approval to launch future uncrewed missions,science
Boeing s tanker drone that has refuelling pod completes 1st flight,technology
Boko Haram claims kidnapping of hundreds of students in Nigeria,world
Bolivia approves 1st same-sex union following 2-year legal battle,world
Bolsonaro congratulates Biden says ready to work with you ,world
Brad Hogg takes a dig at India s top-order batting gets trolled by Wasim Jaffer,sports
Brand new Porsche hits SUV crashes over wall and lands on another car in UK,automobile
Brazilian filmmaker drops iPhone from plane it survives 300m drop & records free fall,technology
Bricks hurled at BJP chief Nadda s convoy in Bengal several injured,politics
Britain readies navy to protect fishing waters in case of no-deal Brexit,world
Brother of Arjun Rampal s girlfriend granted bail in drug case,entertainment
Bug making iPhone users miss text notifications on iOS 14  Reports,technology
Bugs in Cyberpunk 2077 game cost founders $1 billion of wealth,technology
Bumrah has awkward action but he s the real deal  Allan Border,sports
Bumrah will be key for India to retain the Test series vs Aus  Allan Border,sports
Bumrah will tell his grandkids I batted at no. 3 for India  Gavaskar,sports
Can t mourn the way people want me to  Divya on being trolled after dad s death,entertainment
Canada administers first doses of Pfizer coronavirus vaccine,world
Canada pledges $380mn to help developing countries fight COVID-19,world
CD Projekt s shares fall over bad Cyberpunk reviews refund reports,technology
Centre asks WB to relieve 3 IPS officers immediately CM criticises order,politics
China COVID-19 vaccine trials resume in Peru after adverse event ,world
China forcing Uighurs into hard manual labour in cotton fields  Report,world
China helps Pakistan return $1 billion of Saudi Arabia s loan ,world
China not transparent on COVID-19 vaccine emergency use  Brazil,world
China Pak behind farmers protests  Union Minister Raosaheb Danve,politics
China s largest search engine Baidu considers making own EVs  Report,technology
China to open world s largest radio telescope to int l scientists,science
China to vaccinate 5 crore people for Lunar New Year  Report,world
Chinese hackers targeted many Indians with shopping scams  Report,technology
Chinese spacecraft brings 1st lunar samples in over 40 years,science
Choreographer Ganesh Acharya reveals he has lost 98-kg weight,entertainment
Cinemas will be there but digital platforms have wide reach  Rajkummar,entertainment
Coded message from US Zodiac Killer cracked after 51 years,world
Conduct surgical strike on China and Pak  Raut on Danve s remarks,politics
Cong demands account of foreign donations made to PM CARES Fund,politics
Cong mayor candidate loses by 1 vote to BJP opponent in Kerala local body polls,politics
Cong MLCs manhandle remove K taka Legislative Council Dy Chairman,politics
Congress wins 620 seats in municipal body polls in Rajasthan,politics
Contracted COVID-19 because of negligence bad luck  French Prez,world
Corals from Aus Coral IVF trial survive bleaching on track to reproduce,science
Country music star Charley Pride passes away at the age of 86,entertainment
COVID-19 +ve Haryana minister Anil Vij shifted to Gurugram hospital,politics
COVID-19 vaccine delivery to poor nations to start in early 2021  WHO,world
CPI CPI(M) leaders protest in Hyderabad against farm laws,politics
Creator of Google Wallet sells his startup for $365 mn to GoDaddy,technology
Critical care nurse becomes 1st American to get Covid-19 vaccine,world
Data Protection Bill won t get cleared in its current version  BJP MP,technology
Data sciences tech re-evaluate how industries exist  OYO Founder,technology
Deaf S Korean pastor charged in Malaysia with sexually assaulting 2 men,world
Declare a State of Climate Emergency in your nations  UN to leaders,science
Deforestation in Amazon destroyed area bigger than Spain in 18 yrs  Study,science
Delhi govt launches forum to discuss electric vehicle policy,automobile
Delhi startup builds tech to do COVID-19 serosurvey of 1 cr samples per week,technology
Delhi startup builds tech to do COVID-19 serosurvey of 1 cr samples per week,science
Desecration of Mahatma Gandhi s statue in Washington appalling  US,world
Detractors in Congress denied Sharad Pawar PM post twice  Praful Patel,politics
Dhanush joins Ryan Gosling and Chris Evans starrer The Gray Man ,entertainment
Dhoni backed Kohli when he was on the verge of getting dropped  Manjrekar,sports
Didn t know excruciating back pain was a symptom  COVID-19 +ve Ellen,entertainment
Different pitches test different skillsets about time we appreciate that  Jaffer,sports
Digital India made India stand out from the rest  Microsoft CEO,technology
Diljit Dosanjh responds by sharing his schedule after Kangana tweets Diljit Kitthe Aa? ,entertainment
Don t want to think if it s my best or not there s still entire series  Ashwin on 4/55,sports
Donald Trump still pursuing election litigation  White House,world
Drone converted into flying flamethrower to destroy 100 wasp nests in China,world
Drone delivers beer snacks at Michael Jordan s golf course; videos surface,sports
Dy Election Commissioner to pay 2-day visit to Bengal from Dec 17,politics
EC seeks Kerala CM s explanation on free COVID-19 vaccine announcement,politics
Elon Musk only $20 billion away from becoming the world s richest person,technology
Elon Musk only $20 billion away from becoming the world s richest person,automobile
Europe first region to cross 5 00 000 coronavirus deaths,world
Execution of journalist was based on law  Iranian Prez Rouhani,world
Exhausting to be constantly funny I don t post obsessively anymore  Mallika Dua,entertainment
Explosion in Rawalpindi market leaves 25 injured,world
Facebook claims Apple s iOS changes are bad for businesses in ads in US,technology
Facebook didn t ban Bajrang Dal to protect business staff  Report,technology
Facebook Google colluded to weaken ad competition  US antitrust lawsuit,technology
Facebook to move UK users to California terms in Brexit response,technology
Facebook traces OceanLotus hackers to IT firm in Vietnam,technology
Facebook will need users permission before it tracks them  Apple,technology
Fans not allowed for football matches in London again due to COVID-19 spike,sports
Farm laws issue can be solved in 5 mins if PM steps in  Sanjay Raut,politics
Farmers voices must be heard  Indian-American lawmaker on protests,world
Fashion mogul Peter Nygard arrested after US sex trafficking charges,world
Fastest pacer to 50 ODI wickets hit fastest ODI 50 for India,sports
Faulkner jokingly dares Siddle to mankad as bowler warns him for leaving crease early,sports
Fear of contracting COVID-19 led to Lanka prison riot  Probe panel,world
Federer is 39 and still at the top  Ronaldo on motivation levels of athletes,sports
Felt like a child in a private magic show  Nimrat on watching Tenet in theatre,entertainment
Fiat Chrysler to invest $150 mn to set up digital hub in Hyderabad,automobile
First shipments of Pfizer COVID-19 vaccine to arrive in US on Monday,world
Five genes linked to most severe form of COVID-19 found,science
Flies turn into zombies when infected by new fungi species scientists discover,science
For cops their battlefield is everyday life  Rani on 1yr of Mardaani 2 ,entertainment
Forever chemicals used in outdoor gear found in snow on Mt Everest  Study,science
Gabbard introduces bill to ban trans athletes from women s sports,sports
Gal is a great scene partner  Kristen on Wonder Woman 1984 co-star,entertainment
Gal reveals her husband children have cameos in Wonder Woman 1984 ,entertainment
General Motors to not acquire 11% stake in Nikola,automobile
Germany to impose lockdown to curb COVID-19 spread from Dec 16,world
Gibbs resigns as Colombo Kings head coach mid-tournament as COVID-19 hits family,sports
Give him to me and see wonders he does on ground  Akhtar on Amir s retirement,sports
Gmail suffers outage for second time in 2 days,technology
Goal is to make India surpass China in mobile manufacturing  Prasad,technology
Gold silver jewellery washes up on beach in Venezuela; pics surface,world
Good to surprise safest pair of hands  Shaw on video of Saha missing his leg-spin,sports
Google acquires firm that can turn old PCs into Chrome devices,technology
Google delays reopening offices to Sept to test flexible work week  Report,technology
Google Facebook asked to respond on videos alleging Amul s cruelty to cows,technology
Google faces 3rd antitrust lawsuit by US states over abuse of power,technology
Google in talks with Jio Airtel for providing internet via light,technology
Google s AR shopping feature to let users virtually try on makeup,technology
Google services including YouTube Gmail Google Maps go down worldwide,technology
Google sued by 38 US states over alleged abuse of its market power ,technology
Google wins EU approval for $2.1 billion Fitbit deal,technology
Google workers demand reinstatement apology for allegedly fired AI expert,technology
GoT prequel House of the Dragon casts Matt Smith Olivia Cooke  Reports,entertainment
Govt regulation isn t necessarily a bad thing  Instagram Head,technology
Govt s plan is that all kinds of good films should be made  Javadekar,entertainment
Govt to publish list of trusted sources for purchase of telecom equipment,technology
Govt to set up 69 000 EV charging points across India  Gadkari,automobile
Govts corporates should have stricter climate goals  Apple CEO at UN meet,technology
Gunaah Hai Yeh  Australian journalist on Rohit Kohli fans disliking each other,sports
Half of S pore migrant workers in dormitories have had COVID-19,world
Hanoi CDC chief gets 10-yr jail for overstating COVID-19 gear cost,world
Hanuma Vihari slams 21st 1st-class ton as India lead by 472 runs on Day 2,sports
Happy taking the risk  Vikas on releasing The Last... in theatres amid COVID-19,entertainment
Happy that lawless Trump is leaving White House  Iran President,world
Hardik Pandya meets his son Agastya after 4 months shares pic,sports
Harley-Davidson to continue bike sale service in India from Jan,automobile
Have a soft spot for The Fast and the Furious  Tokyo Drift  Nolan,entertainment
Have nothing to do with potential prosecution of Biden s son  Trump,world
Haven t watched many web shows I prefer to watch news  Sidharth,entertainment
Having India-specific community guidelines is complex issue  Facebook,technology
HC seeks Centre AAP s response on plea to ban online gambling sites,technology
He has a lot of swag  Pulkit Samrat on Bigg Boss 14 s Eijaz Khan,entertainment
He has got his form but hunger is alive  Aakash on Agarwal s 61-run knock,sports
He s been my greatest motivator  Shatrughan on Raj Kapoor s birth anniversary,entertainment
He s very simple  Kirti on working with Pankaj in Criminal Justice ,entertainment
Head says India heart says Australia  Shane Warne on who ll win Test series,sports
His legs are a blur when he runs  Mahindra shares video of fastest kid in the world ,sports
Hockey captain Manpreet marries Malaysian girlfriend of Pakistan descent Illi,sports
Honda recalls 737 000 Accord Insight cars in US over software flaw,technology
Honda recalls 737 000 Accord Insight cars in US over software flaw,automobile
Hong Kong is becoming another Chinese-run communist city  US,world
How does the WTC points table read after NZ s 2-0 win over West Indies?,sports
How many Day-Night Tests have been played so far and which team has won the most?,sports
Hrithik s 2016 FIR alleging imposter was talking to Kangana transferred to CIU,entertainment
Huawei tested AI tech to identify Uighur Muslims alert police  Report,technology
Human-made objects to outweigh living things by the end of 2020  Study,science
Hungary bans same-sex couples from adopting children,world
Hungary broke EU asylum rules  European Court of Justice,world
Hyundai Kia agree to $210M US penalty for delay in vehicles recall,automobile
Hyundai to buy 80% stake in SoftBank s robot maker Boston Dynamics,technology
I am being mentally tortured  Pakistan s Mohammad Amir quits international cricket,sports
I believe staying in the moment Virat is our captain now  Rahane on captaining,sports
I d pay to watch KL Rahul play  Brian Lara on his current favourite player ,sports
I deleted my Twitter account after losing 2018-19 Test series against India  Starc,sports
I don t consider it an apology  AI expert on Pichai s statement on her exit ,technology
I feared I ll remain unknown  Manikarnika director on feud with Kangana,entertainment
I feel euphoric  Sir Ian McKellen on receiving COVID-19 vaccine,entertainment
I had an incredible 10-year run  Robert on playing Iron Man,entertainment
I have always been myself I am the representation of new India  Virat Kohli,sports
I have studied acting I am an actor before anything else  Mallika,entertainment
I haven t taken COVID-19 vaccine yet don t want to cut the line  Pfizer CEO,world
I ll observe 1-day fast in support of farmers urge public to fast too  Delhi CM,politics
I ll only do positive roles now no more villain roles  Sonu Sood,entertainment
I m a huge fan of Akshay he s an outstanding actor  Arshad,entertainment
I m not 100% COVID-19 really drains you  Hamilton ahead of Abu Dhabi GP,sports
I never asked Sana to leave showbiz even I was shocked when she quit  Husband,entertainment
I quit college at 19 and worked as peon my father still runs tea stall  Dharmesh,entertainment
I should ve studied Shubman in KKR nets might be too late now  Pat Cummins,sports
I used to stammer acting was a far away thing for me  Sharad,entertainment
I ve moved to Hawaii will use Zoom to work from an island  Oracle Co-founder,technology
I ve prayed for yrs for a man like him  Sana on marrying Anas Saiyad,entertainment
I was typecast in a mother s role very early in life  Shefali Shah,entertainment
I wished I could post pictures showing off my biceps like people do  Anil,entertainment
I would pick Kuldeep ahead of Ashwin for 1st Test  Shane Warne,sports
I wouldn t have done it that big  Clooney on Cruise s COVID-19 rule breach rant,entertainment
IBM CEO Arvind Krishna to take over as Chairman from January,technology
ICC announces qualification pathway for 2022 men s T20 World Cup,sports
ICC prosecutors reject Uighur genocide complaint against China,world
ICC release latest rankings for Test bowlers get trolled by Stuart Broad,sports
If I can wear mask while giving birth you can wear mask while shopping  Sophie,entertainment
If I see it again you re f***ing gone  Cruise to film crew on COVID-19 rule breach,entertainment
If Russia wanted to kill Navalny it would have finished the job  Putin,world
If she invites me I would love to go  Kushal on ex Gauahar s wedding,entertainment
If we can travel and stay in quarantine why can t umpires  Holder,sports
In Tests always keeping skills first  Manjrekar backs Saha over Pant,sports
India being tested will meet the challenge  EAM on China standoff,politics
India bowled really well put us under pressure  Paine after Day 2,sports
India end Day 1 of their first-ever Day-Night Test on Australian soil at 233/6,sports
India had a better side than us in 2018-19 series we were outplayed  Cummins,sports
India lead by 62 runs after Day 2 as Ashwin records his best figures in Australia ,sports
India not historically responsible for climate change  Javadekar,science
India planning surgical strike against us  Pakistan,world
India record their lowest total in Test cricket history post 36/9,sports
India s 1st mRNA vaccine candidate gets DCGI nod for human trials,science
India seen as case study for profound change in modernisation  Nadella,technology
India to produce 300mn doses of Sputnik V vaccine in 2021  Russia,world
India to soon be manufacturing hub of space assets  PM Modi to space industry,science
India will feel the pinch of Kohli s absence in the Test series  Nehra,sports
India will miss Ishant very badly in Tests vs Australia  Manjrekar,sports
Indian bowlers can t get carried away with bouncy wickets in Aus  Kapil,sports
Indian-American Raja Chari among 18 astronauts selected for next moon missions,science
Indian-American Raja Chari selected by NASA to fly to ISS on SpaceX mission,technology
Indian-American Raja Chari selected by NASA to fly to ISS on SpaceX mission,science
Indians are in Christmas mood giving gifts a week early  Gavaskar on fielding,sports
Indonesia to give free COVID-19 vaccine to all its residents,world
Instagram down for some users globally,technology
Instagram star Zombie Angelina Jolie freed days after being jailed in Iran,world
Internal storage quota issue caused 45-minute worldwide outage  Google,technology
Inzamam criticises Waqar Younis for calling Babar Azam s injury major setback ,sports
iPhone factory violence probe finds labour violations by Wistron  Report,technology
Iran journalist who inspired 2017 nationwide protests executed,world
Iran rejects IAEA s call for new nuclear deal after Biden takes office,world
Iran starts building underground nuclear facility at Fordo ,world
Irish train driver s partner s platform proposal for marriage goes viral,world
Islamabad extends ban on protests amid opposition rallies in Pak,world
Israel and Bhutan establish formal diplomatic relations,world
